product_id,product_name,category,sugar_intake
8991102027472,Crystalin Air Mineral Botol Pack 24 x 330 ml,Air Mineral,0
8994016014842,Alfamart Air Mineral Disney Pet Botol 600 ml,Air Mineral,0
8992696525764,Nescafe Minuman Kopi Oat Latte Can 220 ml,Kopi Siap Minum,20
8996006856869,Tehbotol Sosro Minuman Teh Original 300 ml,Teh Siap Minum,32
8991102027700,Panjang Jiwo Timun Suri Larutan Penyegar 350 ml,Minuman Kesehatan,0
8994016011308,Alfamart Air Mineral Carton 24 x 220 ml,Air Mineral,0
8992761136017,Coca-Cola Original Minuman Soda Rasa Kola Botol 1.5 L,Minuman Karbonasi,"10,6"
9556001299178,Starbucks Doubleshot Mocha Kopi Instan Kaleng 220 ml,Kopi Siap Minum,16
8992717822209,Kara Sari Kelapa Rasa Leci 220 ml,Sari Kelapa & Cincau,12
8992761136055,Fanta Minuman Soda Rasa Stroberi Botol 1.5 L,Minuman Karbonasi,66
9556001298379,Nescafe Kopi Hitam Rasa Leci Kaleng 220 ml,Kopi Siap Minum,10
8994016008247,Alfamart Cleo Air Mineral Botol 550 ml,Air Mineral,0
8994016008254,Alfamart Cleo Air Mineral Botol 1.5 L,Air Mineral,0
8801128305792,BTS Coffee Hot Brew Minuman Kopi Americano Botol 350 ml,Kopi Siap Minum,1
8801128305808,BTS Coffee Hot Brew Minuman Kopi Sweet Americano Botol 350 ml,Kopi Siap Minum,2
8885011230880,ITO EN Oi Ocha Minuman Teh Hijau Tanpa Gula Botol 500 ml,Teh Siap Minum,0
8992761136048,Fanta Minuman Soda Rasa Jeruk Vitamin C Botol 1.5 L,Minuman Karbonasi,66
8992761166243,Frestea Nusantara Minuman Teh Rasa Original Botol 350 ml,Teh Siap Minum,15
8859112600064,ITO EN Minuman Teh Hijau Melati Tanpa Gula Botol 500 ml,Teh Siap Minum,0
8992761122324,Frestea Minuman Teh Rasa Melati Botol 500 ml,Teh Siap Minum,36
89686827286,Cocobit Minuman Splash Mangga Botol 350 ml,Jus & Sari Buah,28
8801128945462,Pororo Minuman Rasa Apel Botol 235 ml,Jus & Sari Buah,27
8995227500377,Cap Panda Minuman Liang Teh Kaleng 310 ml,Teh Siap Minum,8
