product_id,product_name,category,sugar_intake
9556156046108,Yeo's Minuman Jeli Sarang Burung Kaleng 300 ml,Minuman Kesehatan,25
8997035601482,Fibe Mini Botol 100 ml,Minuman Kesehatan,9
8998009020186,Buavita Minuman Sari Buah Jambu 245 mL,Jus & Sari Buah,23
8994947000273,ITO EN Oi Ocha Minuman Teh Hijau Tanpa Gula Hojicha Botol 500 ml,Teh Siap Minum,0
8998888150455,SUNQUICK Jus Sari Buah Lemon 330 ml,Jus & Sari Buah,40
8998888150950,Sunquick Jus Sari Buah Jeruk 300 ml,Jus & Sari Buah,36
8998009020216,Buavita Jus Buah Asli Leci 245 ml,Jus & Sari Buah,27
8998009020193,Buavita Jus Buah Asli Mangga 245 ml,Jus & Sari Buah,23
8998009020223,Buavita Jus Buah Asli Apel 250 ml,Jus & Sari Buah,23
8998009020179,Buavita Jus Jeruk 245 ml,Jus & Sari Buah,23
8994016000425,Alfamart Air Mineral Botol 1.5 L,Air Mineral,0
711844162419,ABC Minuman Sari Kacang Hijau 250 ml,Jus & Sari Buah,5
8994016011506,Alfamart Air Mineral Disney Pet Botol 330 ml,Air Mineral,0
8994016013265,Alfamart Air Mineral Disney Flip Top 450 ml,Air Mineral,0
8994016013227,Alfamart Air Mineral Botol 600 ml,Air Mineral,0
8998009030031,Ultra Sari Asem Asli 250 ml,Jus & Sari Buah,29
749921021106,Tropicana Slim Collagen Shot Minuman Tinggi Serat Peach Blossom 190 ml,Minuman Kesehatan,6
749921011671,Lokalate Minuman Kopi Rasa Popcorn Latte 185 ml,Kopi Siap Minum,20
792649436547,100PLUS Active Minuman Isotonik Botol 350 ml,Minuman Kesehatan,19
8998009040412,Ultra Teh Kotak Melati Rendah Gula 750 ml,Teh Siap Minum,17
8998009040405,Ultra Teh Kotak Melati 1000 ml,Teh Siap Minum,80
8991102028158,Panjang Jiwo Larutan Penyegar Melon Botol 350 ml,Minuman Kesehatan,8
8998009040368,Ultra Teh Kotak Mangga 300 ml,Teh Siap Minum,20
8997222540167,Toza Jus Buah Jambu 1 L,Jus & Sari Buah,8.9
8992696527447,Nescafe Minuman Kopi Susu Rasa Coconut Latte Can 220 ml,Kopi Siap Minum,14
8996001600269,Le Minerale Air Mineral Botol 600 ml,Air Mineral,0
8996001600399,Le Minerale Air Mineral Botol 1.5 L,Air Mineral,0
8996006856869,Tehbotol Sosro Minuman Teh Original 300 ml,Teh Siap Minum,22
8996001600375,Le Minerale Air Mineral Botol 330 ml,Air Mineral,0
8886008101053,Aqua Air Mineral Botol 600 ml,Air Mineral,0
8996001600146,Teh Pucuk Harum Melati 350 ml,Teh Siap Minum,18
8998009040023,Ultra Teh Kotak Melati 300 ml,Teh Siap Minum,17
8999510785540,pristine 8.6+ Air Mineral Botol 400 ml,Air Mineral,0
8886008101091,Aqua Air Mineral Botol 1.5 L,Air Mineral,0
8992994110112,Yakult Minuman Probiotik 5 pcs,Minuman Kesehatan,10
8991102026383,Crystalin Air Mineral Pet Botol 1.5 L,Air Mineral,0
8997225200235,Bintang Zero Minuman Berkarbonasi 330 ml,Minuman Karbonasi,15
8886008101336,Aqua Air Mineral Botol 330 ml,Air Mineral,0
8997009510055,You C1000 Minuman Jeruk Vitamin C 140 ml,Minuman Kesehatan,16
8992982201501,Nestle Pure Life Air Mineral Botol 1.5 L,Air Mineral,0
8996001600849,Nipis Madu Minuman Soda Lime 330 ml,Minuman Karbonasi,22
8991102228053,Teh Gelas Original 350 ml,Teh Siap Minum,40
8991102026352,Crystalin Air Mineral Botol 600 ml,Air Mineral,0
8992982206001,Nestle Pure Life Air Mineral Botol 600 ml,Air Mineral,0
8998866202893,Golda Minuman Kopi Cappucino Pet 200 ml,Kopi Siap Minum,19
8992761002022,Sprite Original Minuman Soda Rasa Lemon Jeruk Nipis Botol 390 ml,Minuman Karbonasi,25
8995227500261,Cap Kaki Tiga Larutan Penyegar 500 ml,Minuman Kesehatan,40
8996006858016,Tehbotol Sosro Minuman Teh Original 350 ml,Teh Siap Minum,18
8997009510123,You C1000 Minuman Isotonik Air Jeruk 500 ml,Minuman Kesehatan,20
8992752011057,Vit Air Mineral Botol 1.5 L,Air Mineral,0
8998866201841,Golda Minuman Kopi Dolce Latte Pet 200 ml,Kopi Siap Minum,15
8998866203531,Isoplus Minuman Isotonik Coco 350 ml,Minuman Kesehatan,20
8997009510017,You C1000 Minuman Vitamin C Lemon 140 ml,Minuman Kesehatan,16
8992761002015,Coca-Cola Original Minuman Soda Rasa Kola Botol 390 ml,Minuman Karbonasi,39
8996006857705,S-tee Minuman Teh Melati 390 ml,Teh Siap Minum,26
8996001600252,Teh Pucuk Harum Rendah Gula 350 ml,Teh Siap Minum,5
8992761002039,Fanta Minuman Soda Rasa Stroberi Botol 390 ml,Minuman Karbonasi,11
8999988888972,Sinde Larutan Penyegar Cap BADAK 500 ml,Minuman Kesehatan,40
8991102800020,Kiranti Sehat Datang Bulan 150 ml,Minuman Kesehatan,2.5
89686870022,Ichi Ocha Minuman Teh Hijau 350 ml,Teh Siap Minum,24
8996006861924,S-tee Minuman Teh Melati 200 ml,Teh Siap Minum,17
8998866610377,Isoplus Minuman Isotonik Botol 350 ml,Minuman Energi,20
8998009040283,Ultra Teh Kotak Melati Rendah Gula 300 ml,Teh Siap Minum,17
8998009050053,Ultra Sari Kacang Ijo 250 ml,Jus & Sari Buah,20
8996001600504,Teh Pucuk Harum Melati 250 ml,Teh Siap Minum,18
8998009040375,Ultra Teh Kotak Leci 300 ml,Teh Siap Minum,17
8996006142511,Tehbotol Sosro Minuman Teh Original 250 ml,Teh Siap Minum,22
8992858527308,Hydro Coco Minuman Air Kelapa Original 250 ml,Sari Kelapa & Cincau,7
8992761136178,Sprite Original Minuman Soda Rasa Lemon Jeruk Nipis Botol 1 L,Minuman Karbonasi,100
8992761136185,Fanta Minuman Soda Rasa Stroberi Botol 1L,Minuman Karbonasi,44
8992761136161,Coca Cola Original Minuman Soda Rasa Kola Botol 1 L,Minuman Karbonasi,108
8997035563414,Pocari Sweat Minuman Isotonik Botol 500 ml,Minuman Energi,6
8995227500582,Cap Panda Minuman Cincau Kaleng 310 ml,Sari Kelapa & Cincau,23
8996006858030,Tehbotol SOSRO Minuman Teh Rendah Gula 350 ml,Teh Siap Minum,11
8996001600382,Teh Pucuk Harum Melati 1.3 L,Teh Siap Minum,18
8997009510369,You C1000 Minuman Vitamin C Mango 140 ml,Minuman Kesehatan,20
8995227502814,Cap Panda Minuman Cincau + Selasih Kaleng 310 ml,Sari Kelapa & Cincau,8
8995227500995,Cap Kaki Tiga Anak Larutan Penyegar Leci Kaleng 238 ml,Minuman Kesehatan,"13,75"
8992994110143,Yakult Light Minuman Susu Fermentasi 5 x 65 ml,Minuman Kesehatan,3
8996006856180,Tehbotol Sosro Minuman Teh Original 1 L,Teh Siap Minum,21
8996006858160,Fruit Tea Minuman Teh Blackcurrant 350 ml,Teh Siap Minum,34
8992761166250,Sprite Zero Minuman Soda Rasa Lemon Jeruk Nipis Bebas Gula Botol 1 L,Minuman Karbonasi,0
8996006862105,Fruit Tea Minuman Teh Blackcurrant 250 ml,Teh Siap Minum,18
8998866500708,Floridina Minuman Jeruk 350 ml,Jus & Sari Buah,37
8998009040290,Ultra Teh Kotak Blackcurrant 200 ml,Teh Siap Minum,20
8997218380074,Ichitan Thai Milk Tea Pet 300 ml,Teh Siap Minum,19
8997009510116,You C1000 Minuman Isotonik Lemon Water 500 ml,Minuman Kesehatan,32
8998866202923,Floridina Coco Minuman Jeruk Florida 350 ml,Jus & Sari Buah,19
8999908389008,hemaviton C1000 Jeruk Kaleng 330 ml,Minuman Kesehatan,0
8992761002077,Sprite Zero Minuman Soda Rasa Lemon Jeruk Nipis Bebas Gula Botol 390 ml,Minuman Karbonasi,0
8991102900607,Kiranti Sehat Datang Bulan Jus Jeruk 150 ml,Minuman Kesehatan,2
8992761002060,Coca-Cola Zero Sugar Minuman Soda Rasa Kola Bebas Gula Botol 390 ml,Minuman Karbonasi,0
8997204306590,Bonteh Teh Manis 330 ml,Teh Siap Minum,27
9556001288592,Nescafe Latte Kopi Kaleng 220 ml,Kopi Siap Minum,18
8998009040313,Ultra Teh Kotak Lemon 200 ml,Teh Siap Minum,20
8991002122017,ABC Minuman Kopi Susu 200 ml,Kopi Siap Minum,18
8994171102101,Luwak White Koffie Original Pet 220 ml,Kopi Siap Minum,12
8992761131012,Coca Cola Zero Sugar Minuman Soda Rasa Kola Bebas Gula Botol 1 L,Minuman Karbonasi,0
8992772586030,Adem Sari Chingku Sparkling Herbal Lemon 320 ml,Minuman Kesehatan,36
8996001600207,Teh Pucuk Harum Melati 500 ml,Teh Siap Minum,36
8998866610087,Javana Minuman Teh Melati 350 ml,Teh Siap Minum,28
749921011596,NutriSari Squeezed Orange Minuman Jeruk Peras Vitamin C 200 ml,Jus & Sari Buah,12
8991002122000,ABC Minuman Kopi Chocomalt Pet 200 ml,Kopi Siap Minum,18
8996006852045,Prima Air Mineral Botol 600 ml,Air Mineral,0
8995227500278,Cap Kaki Tiga Larutan Penyegar Leci Kaleng 320 ml,Minuman Kesehatan,21
9556001295248,Nescafe Minuman Es Kopi Hitam 220 ml,Kopi Siap Minum,12
9556001288547,Nescafe Cappuccino Kopi Kaleng 220 ml,Kopi Siap Minum,14
8997009781110,Hydro Coco Minuman Air Kelapa Original 500 ml,Sari Kelapa & Cincau,10
8991102300667,Garantea Minuman Teh Hijau 350 ml,Teh Siap Minum,0
9556001288561,Nescafe Caramel Macchiato Kopi Kaleng 220 ml,Kopi Siap Minum,16
8996006862099,Fruit Tea Minuman Teh Rasa Apel 250 ml,Teh Siap Minum,22
8992761002046,Fanta Minuman Soda Rasa Jeruk Vitamin C Botol 390 ml,Minuman Karbonasi,17
8992772586016,Adem Sari Ching Ku Lemon 320 ml,Minuman Kesehatan,27
8995227501015,Cap Kaki Tiga Anak Larutan Penyegar Stroberi Kaleng 238 ml,Minuman Kesehatan,21.42
8996006858115,Fruit Tea Minuman Teh Freeze 350 ml,Teh Siap Minum,37
8996006858085,Fruit Tea Minuman Teh Apel 350 ml,Teh Siap Minum,34
8991102300599,Garantea Teh Rasa Apel 350 ml,Teh Siap Minum,0
8996006855145,Tehbotol Sosro Minuman Teh Original 450 ml,Teh Siap Minum,32
8999908808905,hemaviton C1000 Jeruk Rendah Gula Kaleng 330 ml,Minuman Kesehatan,5
8997218380135,Ichitan Thai Minuman Teh Hijau Susu Pet 300 ml,Teh Siap Minum,14
8999988888866,Sinde Larutan Penyegar Cap BADAK Leci 320 ml,Minuman Kesehatan,12
8992772585026,Adem Sari Ching Ku Lemon Botol 350 ml,Minuman Kesehatan,14
8992761166212,Frestea Minuman Teh Rasa Apel Botol 350 ml,Teh Siap Minum,23
8992761166038,Minute Maid Pulpy Minuman Jus Buah Rasa Jeruk Botol 300 ml,Jus & Sari Buah,27
8998866201827,JAVANA Minuman Teh Gula Batu 350 ml,Teh Siap Minum,14
8996006853127,Tebs Sparkling Teh Minuman Soda Mix Fruit 330 ml,Teh Siap Minum,31
8992761136208,Minute Maid Pulpy Minuman Jus Buah Rasa Jeruk Botol 1 L,Jus & Sari Buah,108
8992752011408,Vit Air Mineral Botol 550 ml,Air Mineral,0
8997035563544,Pocari Sweat Minuman Isotonik Botol 350 ml,Minuman Energi,16
8996006853400,Fruit Tea Minuman Teh Blackcurrant 500 ml,Teh Siap Minum,22
8850389108062,Mogu Mogu Minuman Nata De Coco Rasa Leci 320 ml,Sari Kelapa & Cincau,35
8997239630097,Adem Sari Ching Ku Madu Lemon 350 ml,Minuman Kesehatan,26
8997035600546,Pocari Sweat Minuman Isotonik Botol 900 ml,Minuman Energi,58
8999908426505,hemaviton C1000 Lemon Kaleng 330 ml,Minuman Kesehatan,0
8999988906133,Lasegar Twist Minuman Penyegar Leci Lemon 320 ml,Minuman Kesehatan,11
8999988889139,Sinde Larutan Penyegar Cap BADAK 350 ml,Minuman Kesehatan,12
8992761166205,Frestea Minuman Teh Hijau Rasa Madu Botol 350 ml,Teh Siap Minum,21
8999988888842,Sinde Larutan Penyegar Cap BADAK Jambu 320 ml,Minuman Kesehatan,12
8996006856715,Tebs Sparkling Teh Minuman Soda Mix Fruit 500 ml,Teh Siap Minum,31
8851123212038,M-150 Minuman Energi 150 ml,Minuman Energi,13
8886057883665,Kratingdaeng Minuman Energi Botol 150 ml,Minuman Energi,25
8999999055714,Buavita Minuman Sari Buah Jambu 1000 ml,Jus & Sari Buah,68
8992388145027,NU Minuman Teh Yogurt Pet 450 ml,Teh Siap Minum,45
8996001600191,Teh Pucuk Harum Rendah Gula 500 ml,Teh Siap Minum,48
8997035600324,Pocari Sweat Minuman Isotonik Botol 2 L,Minuman Energi,128
8991002121089,Good Day Minuman Kopi Originale Cappuccino 250 ml,Kopi Siap Minum,24
8997009510130,You C1000 Minuman Vitamin C Apple 140 ml,Minuman Kesehatan,14
8995227500247,Cap Kaki Tiga Larutan Penyegar Jambu Kaleng 320 ml,Minuman Kesehatan,16
8998288360331,Wong Coco Nata De Coco Sari Kelapa Rasa Cocopandan Pouch 360 g,Sari Kelapa & Cincau,20
8997035601383,Pocari Sweat Ion Water Minuman Isotonik Rendah Kalori Botol 500 ml,Minuman Energi,28
8992761130992,Fanta Minuman Soda Rasa Jeruk Botol 1 L,Minuman Karbonasi,29
8996006858818,Tehbotol Sosro Minuman Teh Tawar 350 ml,Teh Siap Minum,0
8992388133017,NU Minuman Teh Susu 330 ml,Teh Siap Minum,27
8992752091127,Aqua Air Mineral Sport Cap Botol 750 ml,Air Mineral,0
8996006857255,Fruit Tea Minuman Teh Freeze 500 ml,Teh Siap Minum,37
8999988906140,Lasegar Twist Minuman Penyegar Jeruk Lemon 320 ml,Minuman Kesehatan,10
8999988778877,Lasegar Minuman Penyegar Jeruk Nipis 320 ml,Minuman Kesehatan,10
8996006858320,Fruit Tea Minuman Teh Lemon 350 ml,Teh Siap Minum,23
8992752091370,Aqua Life Air Mineral Botol 1.1 L,Air Mineral,0
8996006858276,Fruit Tea Minuman Teh Markisa 350 ml,Teh Siap Minum,23
8850389108048,Mogu Mogu Minuman Nata De Coco Rasa Mangga 320 ml,Sari Kelapa & Cincau,35
9556156001183,Yeo's Minuman Bunga Krisantemum 250 ml,Minuman Kesehatan,11
8992761145019,Coca-Cola Original Minuman Soda Rasa Kola Botol 250 ml,Minuman Karbonasi,27
8997009781400,Hydro Coco Minuman Air Kelapa Original 1 L,Sari Kelapa & Cincau,28
8997218380142,Ichitan Thai Mangga Kelapa Pet 300 ml,Jus & Sari Buah,27
8992775613009,Super O2 Sportivo Air Mineral Botol 600 ml,Air Mineral,0
8992696522961,Nescafe Minuman Kopi Krim 180 ml,Kopi Siap Minum,11
8991002121010,Good Day Minuman Kopi Funtastic Mocacinno 250 ml,Kopi Siap Minum,23
8850389108277,Mogu Mogu Minuman Nata De Coco Rasa Kelapa 320 ml,Sari Kelapa & Cincau,35
8998009050022,Ultra Sari Kacang Ijo 150 ml,Jus & Sari Buah,13
8992388101023,NU Green Tea Madu 450 ml,Teh Siap Minum,40
8997878002224,Pino Ice Cup Bag 6 x 50 g,Jus & Sari Buah,7
8992761145026,Sprite Original Minuman Soda Rasa Lemon Jeruk Nipis Botol 250 ml,Minuman Karbonasi,12
8996006853387,Fruit Tea Minuman Teh Apel 500 ml,Teh Siap Minum,22
8997009781585,Hydro Coco Vita-D Minuman Air Kelapa 330 ml,Sari Kelapa & Cincau,5
8999999055721,Buavita Jus Buah Asli Mangga 1 L,Jus & Sari Buah,9
8997035601222,Oronamin C Drink Botol 120 ml,Minuman Kesehatan,19
749921020680,Tropicana Slim Minuman Oat Vanila 190 ml,Minuman Kesehatan,0
8992388101092,NU Green Tea Madu Pet 330 ml,Teh Siap Minum,18
8997225200037,Green Sands Minuman Karbonasi Lime & Apple Kaleng 330 ml,Minuman Karbonasi,12
8997225200013,Green Sands Minuman Karbonasi Lemon & Grape Kaleng 250 ml,Minuman Karbonasi,10
8992388101085,NU Green Tea Original Pet 330 ml,Teh Siap Minum,0
8997002050411,Naraya Minuman Kedelai Botol 320 ml,Jus & Sari Buah,12
8999988888835,Sinde Larutan Penyegar Cap BADAK Melon 320 ml,Minuman Kesehatan,8
8992752000129,Vit Air Mineral 48 x 200 ml,Air Mineral,0
8850389108055,Mogu Mogu Minuman Nata De Coco Rasa Stroberi 320 ml,Sari Kelapa & Cincau,12
8992388133345,NU Teh Tarik Pet 330 ml,Teh Siap Minum,24
8992761111687,A&W Minuman Soda Rasa Sarsaparila Kaleng 250 ml,Minuman Karbonasi,12
8999908442208,Polaris Mixenergy Minuman Soda Water 330 ml,Minuman Karbonasi,0
8992717781001,Kara Nata De Coco 1 kg,Sari Kelapa & Cincau,120
8850389114438,Mogu Mogu Minuman Nata De Coco Rasa Melon 320 ml,Sari Kelapa & Cincau,12
9556001025272,NESCAFE Cafe Latte Kaleng 220 ml,Kopi Siap Minum,16
8998288220086,Wong Coco Nata De Coco Minuman Sari Kelapa Rasa Leci 220 g,Sari Kelapa & Cincau,31
9556156003385,Yeo's Minuman Cincau Kaleng 300 ml,Sari Kelapa & Cincau,9
8997030380016,E+ Air Mineral Botol 500 ml,Air Mineral,0
8999988888811,Sinde Larutan Penyegar Cap BADAK Rasa Jeruk 320 ml,Minuman Kesehatan,8
9556001299154,Starbucks Doubleshot Espresso Latte Kopi Instan Kaleng 220 ml,Kopi Siap Minum,16
8991002121065,Good Day Minuman Kopi Avocado Delight 250 ml,Kopi Siap Minum,22
8992761135980,Frestea Minuman Teh Rasa Apel Botol 1.5 L,Teh Siap Minum,138
8998009020506,Buavita Mini Jus Buah Asli Jeruk 125 ml,Jus & Sari Buah,10
8997225200051,Green Sands Minuman Karbonasi Lime & Apple Kaleng 250 ml,Minuman Karbonasi,10
8991002125025,Kapal Api Signature Strong Kopi Hitam Pet 200 ml,Kopi Siap Minum,17
8999908260208,NEO Hormoviton Pasak Bumi Minuman Stamina Pria Anggur 150 ml,Minuman Energi,8
9556001047175,Nescafe Minuman Es Kopi Original 220 ml,Kopi Siap Minum,12
8991002125001,Kapal Api Signature Original Kopi Hitam Pet 200 ml,Kopi Siap Minum,17
8997035111110,Pocari Sweat Minuman Isotonik Kaleng 330 ml,Minuman Energi,14
8996006853394,Fruit Tea Minuman Teh Stroberi 500 ml,Teh Siap Minum,22
8995227502074,Cap Kaki Tiga Cooltopia Larutan Penyegar Lemon Lime Kaleng 320 ml,Minuman Kesehatan,23
8850389108314,Mogu Mogu Minuman Nata De Coco Rasa Anggur 320 ml,Sari Kelapa & Cincau,35
8992388133277,NU Green Tea Gula Batu 450 ml,Teh Siap Minum,36
8991749000043,Kopi Kenangan Hanya Untukmu Caffe Latte 200 ml,Kopi Siap Minum,18
8992761135997,Frestea Minuman Teh Rasa Melati Botol 1.5 L,Teh Siap Minum,15
8996006853431,Fruit Tea Minuman Teh X-Treme 500 ml,Teh Siap Minum,20
8997035601017,Pocari Sweat Ion Water Minuman Isotonik Rendah Kalori Botol 350 ml,Minuman Energi,14
8995227500308,Cap Kaki Tiga Larutan Penyegar Jeruk Kaleng 320 ml,Minuman Kesehatan,16
8995227503941,Cap Kaki Tiga Larutan Penyegar 350 ml,Minuman Kesehatan,16
8996001600610,Toracafe Minuman Kopi Es Milky Latte 180 ml,Kopi Siap Minum,9
8997028440012,Red Bull Kratingdaeng Minuman Energi Gold Kaleng 250 ml,Minuman Energi,27
8991002121003,Good Day Minuman Kopi Tiramisu Bliss 250 ml,Kopi Siap Minum,19
8801128945288,Pororo Minuman Rasa Stroberi Botol 235 ml,Jus & Sari Buah,11
8992761145033,Fanta Minuman Soda Rasa Stroberi Botol 250 ml,Minuman Karbonasi,11
8885019061684,Chi Forest Sparkling Water Peach Botol 480 ml,Minuman Karbonasi,0
8809296885801,Pororo Minuman Rasa Bluberi Botol 235 ml,Jus & Sari Buah,11
8992388145324,NU Choco Hazeltea 330 ml,Teh Siap Minum,30
8885019061660,Chi Forest Sparkling Water Lychee Botol 480 ml,Minuman Karbonasi,0
9556156003347,Yeo's Minuman Sari Kedelai Kaleng 300 ml,Minuman Kesehatan,14
8992752112518,Mizone Mood Up Minuman Isotonik Cranberry 500 ml,Minuman Energi,11
8996001600641,Toracafe Minuman Kopi Es Cappuccino 180 ml,Kopi Siap Minum,9
8999510961036,Groovy Root Brew Minuman Karbonasi Sarsaparila Kaleng 330 ml,Minuman Karbonasi,25
8999908442000,Polaris Cafenergy Minuman Soda Kopi Cream Kaleng 330 ml,Minuman Karbonasi,35
8992752112013,Mizone Activ Minuman Isotonik Lemon Leci 500 ml,Minuman Energi,16
8994985002109,Pokka Natsbee Minuman Madu Lemon 450 ml,Jus & Sari Buah,45
8885019061745,Chi Forest Sparkling Water Grape Delight Botol 480 ml,Minuman Karbonasi,0
8999988887111,Sinde Larutan Penyegar Cap BADAK Lemon 320 ml,Minuman Kesehatan,12
8992761122331,Frestea Minuman Teh Rasa Apel Botol 500 ml,Teh Siap Minum,55
8992761122430,Frestea Minuman Teh Green Tea Madu 500 ml,Teh Siap Minum,55
8888200700515,F&N Kopi Minuman Soda Kaleng 325 ml,Kopi Siap Minum,12
8999908034205,Hemaviton Minuman Energi 150 ml,Minuman Energi,6
89686827798,Cocobit Minuman Splash Leci Botol 350 ml,Jus & Sari Buah,28
8997218380128,Ichitan Thai Milk Kopi Pet 300 ml,Kopi Siap Minum,29
8991998117684,Caffino Delizio Oat Cappuccino Minuman Kopi Botol 200 ml,Kopi Siap Minum,15
8992761111588,Coca-Cola Zero Sugar Minuman Soda Rasa Kola Bebas Gula Kaleng 250 ml,Minuman Karbonasi,0
8991749000005,Kopi Kenangan Hanya Untukmu Indonesiano Kopi Hitam Original Pet 200 ml,Kopi Siap Minum,14
8997218380432,Ichitan Thai Milk Kopi Salted Caramel Pet 300 ml,Kopi Siap Minum,29
8997218380166,Ichitan Thai Coco Pet 300 ml,Jus & Sari Buah,18
9002490207267,Red Bull Minuman Energi Kaleng 250 ml,Minuman Energi,28
8991749000029,Kopi Kenangan Hanya Untukmu Minuman Kopi Mantancino 220 ml,Kopi Siap Minum,20
8996001600221,Kopiko 78C Minuman Kopi Latte Pet 240 ml,Kopi Siap Minum,23
9556001054005,Nescafe Minuman Es Kopi Moka 220 ml,Kopi Siap Minum,14
8991002121096,Good Day Minuman Kopi Groovy Cookies 250 ml,Kopi Siap Minum,12
8999999587376,Buavita Jus Korean Persih Putih 245 ml,Jus & Sari Buah,28
8992761147143,Sprite Waterlymon Minuman Soda Rasa Lemon Jeruk Nipis Botol 425 ml,Minuman Karbonasi,10
8997025060015,BIG Cola Minuman Karbonasi 1.6 L,Minuman Karbonasi,10.5
8996006000026,Tebs Zero Minuman Soda Sparkling Leci 300 ml,Minuman Karbonasi,0
8850389108291,Mogu Mogu Minuman Nata De Coco Rasa Nanas 320 ml,Sari Kelapa & Cincau,38
6956367311904,Wong Lo Kat Liang Teh Kaleng 310 ml,Teh Siap Minum,12
8996001600597,Kopiko Lucky Day Minuman Kopi Pet 180 ml,Kopi Siap Minum,10
8991749000012,Kopi Kenangan Hanya Untukmu Minuman Kopi Black Aren 220 ml,Kopi Siap Minum,8
711844162426,ABC Minuman Asam Jawa 250 ml,Jus & Sari Buah,18
8991998117585,Caffino Delizio Milky Espresso Minuman Kopi Botol 200 ml,Kopi Siap Minum,12
8999999055738,Buavita Jus Buah Asli Jeruk 1 L,Jus & Sari Buah,92
648436301010,Pororo Minuman Rasa Mangga Botol 235 ml,Jus & Sari Buah,11
8998888121943,Del Monte Boba Red Velvet Kaleng 240 ml,Kopi Siap Minum,23
8998888121646,Del Monte Boba Teh Susu Taro Kaleng 240 ml,Teh Siap Minum,32
8999999055691,Buavita Jus Apel 1 L,Jus & Sari Buah,120
8997212801322,Hydroplus Minuman Isotonik Botol 350 ml,Minuman Energi,10
8998898923704,Alang Sari Cool Minuman Jeruk Nipis 300 ml,Minuman Kesehatan,18
8994907001760,ABC Minuman Sari Kacang Hijau 3 x 250 ml,Jus & Sari Buah,45
8991749000036,Kopi Kenangan Hanya Untukmu Minuman Kopi Avocuddle 220 ml,Kopi Siap Minum,20
8996006861955,Country Choice Jus Fit Fresh Guardian Red 250 ml,Jus & Sari Buah,8
8996006861986,Tebs Sparkling Lemon Lime Botol 300 ml,Teh Siap Minum,10
8998888111241,Del Monte Vanila Latte Minuman Kopi Chewy Boba Kaleng 240 ml,Kopi Siap Minum,28
8993138142204,Prima Rasa Minuman Fruit Cocktail Cup 220 ml,Jus & Sari Buah,18
8998888121745,Del Monte Boba Kopi Karamel Keju Kaleng 240 ml,Kopi Siap Minum,28
8999988901312,acaraki Golden Sparkling Kunyit Asam Minuman Soda Kaleng 320 ml,Minuman Kesehatan,12
711844160071,ABC Jus Jambu 250 ml,Jus & Sari Buah,28
648436301027,Pororo Minuman Rasa Persik Botol 235 ml,Jus & Sari Buah,27
8992761111717,Coca-Cola Zero Sugar K-Wave Minuman Karbonasi Fruity Fantasy Kaleng 250 ml,Minuman Karbonasi,0
8998288510002,Wong Coco Aloe Vera Minuman Lidah Buaya Rasa Lemon Bucket 1 kg,Sari Kelapa & Cincau,40
8886057883672,Kratingdaeng Super Minuman Energi Botol 150 ml,Minuman Energi,27
8850389117620,Mogu Mogu Jeli Leci Nata de Coco 150 ml,Sari Kelapa & Cincau,12
711844160118,ABC Jus Mangga 250 ml,Jus & Sari Buah,24
8995151170042,mustika ratu Gula Asam 200 ml,Minuman Kesehatan,12
711844160095,ABC Jus Sirsak 250 ml,Jus & Sari Buah,23
711844160033,ABC Jus Leci 250 ml,Jus & Sari Buah,20
8994116101107,Country Choice Minuman Sari Buah Jambu 1 L,Jus & Sari Buah,60
8994985000273,Pokka Minuman Teh Leci 450 ml,Teh Siap Minum,30
8801128305822,BTS Coffee Hot Brew Minuman Kopi Red Latte Botol 350 ml,Kopi Siap Minum,20
8888196124128,Pokka Minuman Teh Hijau Melati 300 ml,Teh Siap Minum,15
8850389117644,Mogu Mogu Jeli Stroberi Nata de Coco 150 ml,Sari Kelapa & Cincau,12
711844160057,ABC Jus Apel 250 ml,Jus & Sari Buah,30
711844160019,ABC Jus Jeruk 250 ml,Jus & Sari Buah,26
8998288280134,Wong Coco Aloe Vera Minuman Lidah Buaya Rasa Anggur Low Sugar Pouch 280 g,Sari Kelapa & Cincau,5
8994985000266,Pokka Minuman Teh Rasa Mangga 450 ml,Teh Siap Minum,30
8994116900069,Country Choice Minuman Sari Buah Apple 1 L,Jus & Sari Buah,60
8996006861962,Country Choice Jus Fit Fresh Purify Green 250 ml,Jus & Sari Buah,24
8994116101145,Country Choice Minuman Sari Buah Jeruk 1 L,Jus & Sari Buah,60
8992003787335,Kojima Minuman Madu Habbatussauda Tamarind Botol 340 ml,Jus & Sari Buah,20
8998888153555,SUNQUICK Jus Sari Buah Jeruk Mandarin 300 ml,Jus & Sari Buah,21
74410741860,Pokka Minuman Teh Hijau Jepang 300 ml,Teh Siap Minum,14
8998888152756,SUNQUICK Jus Sari Buah Mango 300 ml,Jus & Sari Buah,23
8888196120724,Pokka Minuman Teh Oolong 300 ml,Teh Siap Minum,16
8997004910300,X'Tragin Minuman Serbuk Es Kunyit Asam + Madu 5 x 23 g,Minuman Kesehatan,18
8992726953604,Inaco Nata de Coco dalam Sirup Rasa Cocopandan Pouch 360 g,Sari Kelapa & Cincau,40.6
8998888111340,Del Monte Mocha Latte Minuman Kopi Chewy Boba Kaleng 240 ml,Kopi Siap Minum,18
8991102677905,Kuas Minuman Kunyit Asam Original 250 ml,Minuman Kesehatan,18
8992726938663,Inaco Nata de Coco dalam Sirup Rasa Vanila Pouch 360 g,Sari Kelapa & Cincau,36
8994010020764,Sunpride Jus Buah Jambu Kaleng 220 ml,Jus & Sari Buah,33
8994010020030,Sunpride Jus Buah Nanas Kaleng 220 ml,Jus & Sari Buah,30
8992726122802,Inaco Minuman Lidah Buaya Rasa Buah Peach 280 g,Jus & Sari Buah,28
8992726827233,Inaco Minuman Lidah Buaya Rasa Buah Leci 280 g,Jus & Sari Buah,28
8991102779098,Kuas Minuman Kunyit Asam Lemon 250 ml,Minuman Kesehatan,20
8997222540174,Toza Jus Buah Sirsak 1 L,Jus & Sari Buah,0
8999988888828,Sinde Larutan Penyegar Cap Badak Strawberry 320 ml,Minuman Kesehatan,8
89686827781,Cocobit Splash Coco Minuman Rasa Kelapa 350 ml,Jus & Sari Buah,28
8996006858108,Fruit Tea Minuman Teh Stroberi Botol 350 ml,Teh Siap Minum,18
8998009040139,Ultra Teh Kotak Rasa Melati 500 ml,Teh Siap Minum,17
8994016000432,Alfamart Air Mineral Botol 535 ml,Air Mineral,0
8997020120059,Sanford Air Mineral Pet Botol 1.5 L,Air Mineral,0
8851123212861,M-150 Minuman Energi Kaleng 250 ml,Minuman Energi,38
8997020120042,Sanford Air Mineral Pet Botol 600 ml,Air Mineral,0
8999988778860,Lasegar Minuman Penyegar Leci Kaleng 320 ml,Minuman Kesehatan,0
8999988778846,Lasegar Minuman Penyegar Jambu Kaleng 320 ml,Minuman Kesehatan,0
8995182400016,Narmada Air Mineral 48 x 220 ml,Air Mineral,0
8994016000425,Alfamart Air Mineral Botol 1.5 L,Air Mineral,0
8997020120196,Sanford Air Mineral 48 x 220 ml,Air Mineral,0
8993298310147,Mountoya Air Mineral Pet Botol 600 ml,Air Mineral,0
8995182400026,Narmada Air Mineral Botol 600 ml,Air Mineral,0
8992761111670,Schweppes Botanical Minuman Soda Rasa Tonik Kaleng 250 ml,Minuman Karbonasi,"6,5"
8992761111533,Sprite Original Minuman Soda Rasa Lemon Jeruk Nipis Kaleng 250 ml,Minuman Karbonasi,12
8997020020021,Al Qodiri Air MIneral Pet 600 ml,Air Mineral,0
8993093665305,BW Air Mineral Pet Botol 600 ml,Air Mineral,0
8994016000449,Alfamart Air Mineral 48 x 240 ml,Air Mineral,0
8997002050015,Naraya Minuman Cincau Kaleng 300 ml,Sari Kelapa & Cincau,8
9555376800071,Starway Minuman Susu Kedelai 310 ml,Minuman Kesehatan,3
43947522,Tirmas Air Mineral Cup 48 x 240 ml,Air Mineral,0
8992761111540,Fanta Minuman Soda Rasa Stroberi Kaleng 250 ml,Minuman Karbonasi,11
8997221630043,Daxu Air Mineral Pet 600 ml,Air Mineral,0
9556007001737,drinho Chrysanthemum Tea Kaleng 300 ml,Teh Siap Minum,"11,3"
8997003810304,Dmax Air Mineral Pet 330 ml,Air Mineral,0
8992761166052,Frestea Jasmine Minuman Teh Rasa Melati Botol 350 ml,Teh Siap Minum,12
8994985000006,Pokka Minuman Teh Hijau Melati 450 ml,Teh Siap Minum,14
8992761166229,Frestea Minuman Teh Rasa Markisa Botol 350 ml,Teh Siap Minum,15
8991749000098,Kopi Kenangan Hanya Untukmu Minuman Kopi Cheese Latte 200 ml,Kopi Siap Minum,16
8998009040306,Ultra Teh Kotak Apel 300 ml,Teh Siap Minum,20
8991102028035,Panjang Jiwo Larutan Penyegar Lidah Buaya Botol 350 ml,Minuman Kesehatan,0
